caso_id,tomo,tipo_cambio,metodo,old_outcome,new_outcome,old_vp,new_vp,old_n,new_n,old_pet,new_pet,new_firma
342_p1252,342,mejora_gano_firma,forward_con_firma,otro,revoca,sin_firma,unanime,0,4,de conformidad con lo establecido por el art. 3841 del Códig,"Por ello, oída la señora Procuradora Fiscal subrogante, se d",Elena I. Highton de Nolasco — Juan Carlos Maqueda — Ricardo Luis Lorenzetti — Ho
342_p1327,342,mejora_gano_firma,forward_con_firma,otro,otro,sin_firma,disidencia,0,2,"En consecuencia, cabe sostener prima facie que los hechos de","En consecuencia, la visión del Tribunal, en casos de afectac",Carlos Fernando Rosenkrantz (en disidencia)— Elena I. Highton
342_p1404,342,mejora_gano_firma,forward_con_firma,otro,otro,sin_firma,unanime,0,5,"En consecuencia, esta Corte establecerá como monto indemniza","Por ello, se decide: Hacer lugar a la demanda seguida por la",Carlos Fernando Rosenkrantz — Elena I. Highton de Nolasco — Juan Carlos Maqueda 
342_p1591,342,mejora_gano_firma,forward_con_firma,otro,otro,sin_firma,disidencia,0,4,"En mérito a lo expuesto, en esta evaluación inaugural del ca",Por ello se resuelve: I. Declarar que la presente causa corr,Carlos Fernando Rosenkrantz (en disidencia)— Juan Carlos Maqueda — Ricardo Luis 
342_p1620,342,mejora_gano_firma,forward_con_firma,otro,hace_lugar,sin_firma,unanime,0,5,"En consecuencia, es indiscutible que los vicios endilgados s","Por ello, se hace lugar a la queja, se declara procedente el",Carlos Fernando Rosenkrantz — Elena I. Highton de Nolasco — Juan Carlos Maqueda 
342_p1665,342,mejora_gano_firma,forward_con_firma,otro,procedente,sin_firma,mixed,0,5,"En consecuencia, en la presente causa se suscita un conflict","Por ello, oída la señora Procuradora General, se declara ino",Carlos Fernando Rosenkrantz (en disidencia)— Elena I. Highton de Nolasco (en dis
342_p1938,342,mejora_gano_firma,forward_con_firma,otro,otro,sin_firma,mixed,0,5,"Por estas razones, se debe revocar la sentencia apelada en e","Por ello, de conformidad -en lo pertinente- con lo dictamina",Carlos Fernando Rosenkrantz — Elena I. Highton de Nolasco — Juan Carlos Maqueda 
342_p2009,342,mejora_gano_firma,forward_con_firma,otro,confirma,sin_firma,segun_su_voto,0,5,"Por ello, teniendo en cuenta el momento en que se produjo el","Por ello, y concordemente con lo dictaminado por la señora P",Carlos Fernando Rosenkrantz (según su voto)— Elena I. Highton de Nolasco — Juan 
342_p2136,342,mejora_gano_firma,forward_con_firma,otro,originaria,sin_firma,disidencia,0,5,en consecuencia.,"Por ello, se resuelve: I. Declarar concluido este proceso.",Carlos Fernando Rosenkrantz (en disidencia parcial)— Elena I. Highton de Nolasco
342_p2256,342,mejora_gano_firma,forward_con_firma,otro,otro,sin_firma,disidencia,0,5,en consecuencia ser interpretadas las normas de aquella de m,"Por ello, y de conformidad con lo dictaminado por la señora ",Carlos Fernando Rosenkrantz (en disidencia)— Elena I. Highton de Nolasco (en dis
342_p2344,342,mejora_gano_firma,forward_con_firma,otro,otro,sin_firma,disidencia,0,4,"En consecuencia, si bien es cierto que la Corte Suprema solo","Por lo expuesto, oído el señor Procurador General de la Naci",Carlos Fernando Rosenkrantz (en disidencia parcial)— Juan Carlos Maqueda — Ricar
343_p38,343,mejora_gano_firma,forward_con_firma,otro,otro,sin_firma,unanime,0,3,de conformidad con lo previsto en la cláusula undécima del p,"Por ello, se resuelve hacer lugar a la queja, declarar proce",Carlos Fernando Rosenkrantz — Juan Carlos Maqueda — Ricardo Luis Lorenzetti.
343_p140,343,mejora_gano_firma,forward_con_firma,otro,procedente,sin_firma,unanime,0,4,"Por ello, la revisión judicial en juego, por ser la más deli","Por ello, y concordemente con lo dictaminado por la señora P",Carlos Fernando Rosenkrantz — Elena I. Highton de Nolasco — Ricardo Luis Lorenze
343_p195,343,mejora_gano_firma,forward_con_firma,otro,otro,sin_firma,mixed,0,6,"Por todo ello, solicita la habilitación de días y horas inhá","Por todo lo expuesto, la cuestión sobre el carácter presenci",Carlos Fernando Rosenkrantz (en disidencia parcial)— Elena I. Highton de Nolasco
343_p283,343,mejora_gano_firma,forward_con_firma,otro,otro,sin_firma,unanime,0,3,"En consecuencia, el pleito corresponde al conocimiento de lo","Por ello, y oído el señor Procurador Fiscal de la Nación, se",Carlos Fernando Rosenkrantz — Elena I. Highton de Nolasco — Juan Carlos Maqueda.
343_p373,343,mejora_gano_firma,forward_con_firma,otro,otro,sin_firma,disidencia,0,5,"En consecuencia, el tema a decidir en el presente es el crit","Por ello, en atención al estado de las presentes actuaciones",Carlos Fernando Rosenkrantz (en disidencia)— Elena I. Highton de Nolasco (en dis
343_p396,343,mejora_gano_firma,forward_con_firma,otro,otro,sin_firma,disidencia,0,5,"En consecuencia, el tema a decidir en el presente es el crit","Por ello, en atención al estado de las presentes actuaciones",Carlos Fernando Rosenkrantz (en disidencia)— Elena I. Highton de Nolasco (en dis
343_p603,343,mejora_gano_firma,forward_con_firma,otro,otro,sin_firma,segun_su_voto,0,5,"En consecuencia, una comprensión amplia de la compleja situa","Por ello, en atención al estado de las presentes actuaciones",Carlos Fernando Rosenkrantz (según su voto)— Elena I. Highton de Nolasco — Juan 
343_p1259,343,mejora_gano_firma,forward_con_firma,otro,desestima,sin_firma,segun_su_voto,0,4,"Por ello, menos aún puede argumentarse que dicho instrumento","Por ello, oída la señora Procuradora Fiscal, se desestima el",Carlos Fernando Rosenkrantz — Elena I. Highton de Nolasco — Juan Carlos Maqueda 
343_p1457,343,mejora_gano_firma,forward_con_firma,otro,originaria,sin_firma,unanime,0,1,"Por ello, oído el señor Procurador General de la Nación inte","Por ello, oído el señor Procurador General, se resuelve: I. ",Elena I. Highton de Nolasco.
343_p1738,343,mejora_gano_firma,forward_con_firma,otro,otro,sin_firma,unanime,0,3,en consecuencia dictada por autoridad jurisdiccional extranj,"Por lo expuesto, de conformidad en lo pertinente con lo dict",Elena I. Highton de Nolasco — Juan Carlos Maqueda — Ricardo Luis Lorenzetti. Rec
343_p1784,343,mejora_gano_firma,forward_con_firma,otro,hace_lugar,sin_firma,segun_su_voto,0,4,"en consecuencia, hizo lugar a la acción entablada por Rosa A","Por ello, se hace lugar a la queja, se declara procedente el",Carlos Fernando Rosenkrantz (según su voto) — Elena I. Highton de Nolasco — Juan
343_p1923,343,mejora_gano_firma,forward_con_firma,otro,competencia,sin_firma,unanime,0,5,"De conformidad con lo dispuesto por el art. 21, inc. 1º, de ","Por ello, por mayoría, se resuelve: I.- Declarar que es esta",Carlos Fernando Rosenkrantz — Elena I. Highton de Nolasco — Juan Carlos Maqueda 
343_p2087,343,mejora_gano_firma,forward_con_firma,otro,otro,sin_firma,disidencia,0,4,"En consecuencia, si el agravio invocado como sustento de la ","Por ello, cuando la Corte ha exigido que la acción entablada",Carlos Fernando Rosenkrantz (en disidencia)— Elena I. Highton de Nolasco — Juan 
343_p2211,343,mejora_gano_firma,forward_con_firma,otro,revoca,sin_firma,unanime,0,4,"En consecuencia, en la presente causa se suscita un conflict","Por ello, y habiendo dictaminado el señor Procurador Fiscal,",Carlos Fernando Rosenkrantz — Juan Carlos Maqueda — Ricardo Luis Lorenzetti — Ho
343_p2280,343,mejora_gano_firma,forward_con_firma,otro,otro,sin_firma,segun_su_voto,0,4,"en consecuencia, se aduce que “la participación de los encar","Por ello, habiendo dictaminado la señora Procuradora General",Carlos Fernando Rosenkrantz (según su voto)— Juan Carlos Maqueda — Ricardo Luis 
344_p81,344,mejora_gano_firma,forward_con_firma,otro,otro,sin_firma,unanime,0,5,"Por todo ello, el agravio planteado prescinde de las constan","Por ello, oído el señor Procurador General de la Nación inte",Carlos Fernando Rosenkrantz – Elena I. Highton de Nolasco – Juan Carlos Maqueda 
344_p277,344,mejora_gano_firma,forward_con_firma,otro,hace_lugar,sin_firma,segun_su_voto,0,4,"en consecuencia sobre el fondo de la causa, en sustitución d","Por ello, y oída la señora Procuradora Fiscal, se hace lugar",Carlos Fernando Rosenkrantz – Elena I. Highton de Nolasco – Juan Carlos Maqueda 
344_p494,344,mejora_gano_firma,forward_con_firma,otro,otro,sin_firma,segun_su_voto,0,5,de conformidad con las leyes 25.675 General del Ambiente (LG,"Por ello, oída en esta instancia la señora Procuradora Fisca",Carlos Fernando Rosenkrantz (según su voto)– Elena I. Highton de Nolasco (según 
344_p507,344,mejora_gano_firma,forward_con_firma,otro,otro,sin_firma,disidencia,0,4,"En consecuencia, adujo que a pesar de la reforma constitucio",Por ello y de conformidad con lo oportunamente dictaminado p,Carlos Fernando Rosenkrantz (en disidencia parcial)– Juan Carlos Maqueda – Ricar
344_p809,344,mejora_gano_firma,forward_con_firma,otro,hace_lugar,sin_firma,segun_su_voto,0,4,Por ello como se reconoció en los precedentes citados la Ciu,"Por ello, y oído el señor Procurador General de la Nación in",Carlos Fernando Rosenkrantz (según su voto)– Juan Carlos Maqueda – Ricardo Luis 
344_p936,344,mejora_gano_firma,forward_con_firma,otro,originaria,sin_firma,segun_su_voto,0,4,"En consecuencia, no se trata de una mera indagación o consul","Por ello, concordemente con el dictamen de la señora Procura",Carlos Fernando Rosenkrantz (según su voto)– Elena I. Highton de Nolasco – Juan 
344_p1013,344,mejora_gano_firma,forward_con_firma,otro,procedente,sin_firma,segun_su_voto,0,5,"En consecuencia, concluyó en que el acto impugnado resultaba","Por ello, se declara procedente el recurso extraordinario y ",Carlos Fernando Rosenkrantz (según su voto)– Elena I. Highton de Nolasco – Juan 
344_p1033,344,mejora_gano_firma,forward_con_firma,otro,originaria,sin_firma,unanime,0,5,"de conformidad con lo normado por el art. 27, primer párrafo","Por ello, de conformidad con lo dictaminado por la señora Pr",Carlos Fernando Rosenkrantz – Elena I. Highton de Nolasco – Juan Carlos Maqueda 
344_p1082,344,mejora_gano_firma,forward_con_firma,abstracto,otro,sin_firma,unanime,0,3,"Por ello, cabe excluir ese cargo de la procedencia de la ext","Por lo expuesto, de conformidad en lo pertinente con lo dict",Elena I. Highton de Nolasco – Juan Carlos Maqueda – Ricardo Luis Lorenzetti. Rec
344_p1270,344,mejora_gano_firma,forward_con_firma,otro,desestima,sin_firma,segun_su_voto,0,5,"De conformidad con ello, quien pretenda la revisión judicial","Por ello, se desestima la queja. Notifíquese y, oportunament",Carlos Fernando Rosenkrantz (según su voto)– Elena I. Highton de Nolasco – Juan 
344_p1464,344,mejora_gano_firma,forward_con_firma,otro,procedente,sin_firma,disidencia,0,5,"En consecuencia, la consideración ab initio del a quo, se ap","Por ello, se declara procedente el recurso ordinario interpu",Carlos Fernando Rosenkrantz – Elena I. Highton de Nolasco – Juan Carlos Maqueda 
344_p1557,344,mejora_gano_firma,forward_con_firma,otro,confirma,sin_firma,segun_su_voto,0,2,"Por ello, el hecho de que el legislador local —a diferencia ","Por todo lo expuesto, y habiendo dictaminado la señora Procu",Elena I. Highton de Nolasco – Ricardo Luis Lorenzetti – Martín Irurzun (según su
344_p1642,344,mejora_gano_firma,forward_con_firma,otro,competencia,sin_firma,disidencia,0,5,"En consecuencia, el tema a decidir en el presente es el crit","Por ello, y de conformidad con lo dictaminado por el señor P",Carlos Fernando Rosenkrantz (en disidencia)– Elena I. Highton de Nolasco (en dis
344_p1857,344,mejora_gano_firma,forward_con_firma,otro,otro,sin_firma,segun_su_voto,0,4,"Por ello, la facultad de los jueces locales de denegar el re","Por ello, y oída la señora Procuradora Fiscal, se declara pr",Carlos Fernando Rosenkrantz – Elena I. Highton de Nolasco – Juan Carlos Maqueda 
344_p2062,344,mejora_gano_firma,forward_con_firma,otro,otro,sin_firma,disidencia,0,5,"En consecuencia, deben desestimarse los agravios en que se s","Por ello, de conformidad en lo pertinente con lo dictaminado",Carlos Fernando Rosenkrantz – Elena I. Highton de Nolasco (en disidencia)– Juan 
344_p2339,344,mejora_gano_firma,forward_con_firma,otro,confirma,sin_firma,segun_su_voto,0,5,"En consecuencia, admitir el planteo del actor en lo que se r","Por ello, y concordemente con lo dictaminado por el señor Pr",Carlos Fernando Rosenkrantz – Elena I. Highton de Nolasco – Juan Carlos Maqueda 
344_p2441,344,mejora_gano_firma,forward_con_firma,otro,desestima,sin_firma,segun_su_voto,0,5,"De conformidad con el trámite previsto por la ley 1565, se d","Por ello, se desestima la queja. Notifíquese y, oportunament",Carlos Fernando Rosenkrantz (según su voto)– Elena I. Highton de Nolasco (según 
344_p2513,344,mejora_gano_firma,forward_con_firma,otro,otro,sin_firma,disidencia,0,5,"Por ello, si el legislador hubiese querido incluir otra exce","Por todo lo expuesto, oída la señora Procuradora Fiscal, se ",Carlos Fernando Rosenkrantz (en disidencia)– Elena I. Highton de Nolasco (en dis
344_p2647,344,mejora_gano_firma,forward_con_firma,otro,procedente,sin_firma,unanime,0,5,"En consecuencia, resulta evidente que en el caso no se ha co","Por ello, con el alcance que surge del presente pronunciamie",Horacio Rosatti – Carlos Fernando Rosenkrantz – Juan Carlos Maqueda – Elena I. H
344_p2868,344,mejora_gano_firma,forward_con_firma,otro,hace_lugar,sin_firma,segun_su_voto,0,5,"en consecuencia, ordenó al Instituto de Obra Social de la Pr","Por ello, y habiendo dictaminado el señor Procurador Fiscal,",Horacio Rosatti (según su voto)– Carlos Fernando Rosenkrantz – Juan Carlos Maque
344_p3156,344,mejora_gano_firma,forward_con_firma,otro,otro,sin_firma,unanime,0,4,"Atento a que, en el recurso extraordinario federal, la defen","Por lo expuesto, el Tribunal resuelve: I) Declarar procedent",Horacio Rosatti – Juan Carlos Maqueda – Elena I. Highton de Nolasco – Ricardo Lu
344_p3458,344,mejora_gano_firma,forward_con_firma,otro,otro,sin_firma,unanime,0,4,"Por todo ello, concluye que la decisión apelada consagra una","Por ello, con base en circunstancias sustantivas directament",Horacio Rosatti – Carlos Fernando Rosenkrantz – Juan Carlos Maqueda – Ricardo Lu
344_p3551,344,mejora_gano_firma,forward_con_firma,otro,confirma,sin_firma,unanime,0,4,"Por ello, solicitaron a la jueza federal que se excluyese a ","Por ello, se rechaza el recurso extraordinario y, con el alc",Horacio Rosatti – Carlos Fernando Rosenkrantz – Juan Carlos Maqueda – Ricardo Lu
344_p3600,344,mejora_gano_firma,forward_con_firma,otro,procedente,sin_firma,segun_su_voto,0,4,"En consecuencia, revocó la sentencia y declaró la nulidad de","Por ello, se declara procedente el recurso extraordinario y ",Horacio Rosatti - Carlos Fernando Rosenkrantz (según su voto)– Juan Carlos Maque
345_p22,345,mejora_gano_firma,forward_con_firma,otro,otro,sin_firma,segun_su_voto,0,4,"Por ello, solicita que se haga cesar el estado de incertidum","Por ello, de conformidad con lo dictaminado por la señora Pr",Horacio Rosatti — Carlos Fernando Rosenkrantz (según su voto)— Juan Carlos Maque
345_p37,345,mejora_gano_firma,forward_con_firma,otro,competencia,sin_firma,disidencia,0,4,"En consecuencia, el tema a decidir en el presente es el crit","Por ello, y de conformidad con lo dictaminado por el señor P",Horacio Rosatti — Carlos Fernando Rosenkrantz (en disidencia)— Juan Carlos Maque
345_p76,345,mejora_gano_firma,forward_con_firma,otro,otro,sin_firma,unanime,0,4,"En consecuencia, es dable concluir que se encuentran reunido","Por ello, y concordemente con lo dictaminado por la señora P",Horacio Rosatti — Carlos Fernando Rosenkrantz — Juan Carlos Maqueda — Ricardo Lu
345_p270,345,mejora_gano_firma,forward_con_firma,otro,otro,sin_firma,unanime,0,4,"En consecuencia, y siguiendo el criterio expuesto por esta C",Por ello es razonable sostener una interpretación del artícu,Horacio Rosatti — Carlos Fernando Rosenkrantz — Juan Carlos Maqueda — Ricardo Lu
345_p358,345,mejora_gano_firma,forward_con_firma,otro,procedente,sin_firma,unanime,0,4,"En consecuencia, teniendo en cuenta las obligaciones que se ","Por ello, habiendo dictaminado el señor Procurador Fiscal y ",Horacio Rosatti — Carlos Fernando Rosenkrantz — Juan Carlos Maqueda — Ricardo Lu
345_p440,345,mejora_gano_firma,forward_con_firma,otro,desestima,sin_firma,unanime,0,4,"por ello, no se verificaba la incompetencia de los tribunale","Por ello, se desestima la queja. Intímese a la recurrente a ",Horacio Rosatti — Carlos Fernando Rosenkrantz — Juan Carlos Maqueda — Ricardo Lu
345_p549,345,mejora_gano_firma,forward_con_firma,otro,otro,sin_firma,unanime,0,4,"Por ello, se tuvo presente que “reglamentar adecuadamente el","Por ello, habiendo dictaminado el señor Procurador General d",Horacio Rosatti - Carlos Fernando Rosenkrantz – Juan Carlos Maqueda – Ricardo Lu
345_p583,345,mejora_gano_firma,forward_con_firma,otro,otro,sin_firma,disidencia,0,4,de conformidad con el art. 2° de la ley 20.396 (art. 3°). Se,"Por ello, si bien es cierto que para establecer los límites ",Horacio Rosatti (en disidencia)- Carlos Fernando Rosenkrantz – Juan Carlos Maque
345_p905,345,mejora_gano_firma,forward_con_firma,otro,otro,sin_firma,disidencia,0,4,"En consecuencia, la solución de la controversia planteada en",Por todo ello es posible sostener que la voluntaria suspensi,Horacio Rosatti — Carlos Fernando Rosenkrantz (en disidencia)— Juan Carlos Maque
345_p1269,345,mejora_gano_firma,forward_con_firma,otro,otro,sin_firma,unanime,0,3,"Por todo ello, la sentencia recurrida extiende equivocadamen","Por ello, oído el señor Procurador General de la Nación inte",Horacio Rosatti - Carlos Fernando Rosenkrantz – Juan Carlos Maqueda. Recurso ext
345_p1342,345,mejora_gano_firma,forward_con_firma,otro,procedente,sin_firma,unanime,0,3,"en consecuencia, hizo lugar a la acción de amparo y declaró ","Por ello, de conformidad con lo dictaminado por el señor Pro",Horacio Rosatti — Carlos Fernando Rosenkrantz — Juan Carlos Maqueda. Recurso ext
345_p1421,345,mejora_gano_firma,forward_con_firma,otro,otro,sin_firma,unanime,0,4,"Por lo expuesto, luego de la ponderación integral de todo lo","Por ello, oído el señor Procurador General de la Nación inte",Horacio Rosatti — Carlos Fernando Rosenkrantz — Juan Carlos Maqueda — Ricardo Lu
346_p25,346,mejora_gano_firma,forward_con_firma,otro,hace_lugar,sin_firma,unanime,0,4,"En consecuencia, expresó que asistía razón al recurrente en ","Por ello, oída la señora Procuradora Fiscal, se hace lugar a",Horacio Rosatti — Carlos Fernando Rosenkrantz — Juan Carlos Maqueda — Ricardo Lu
346_p407,346,mejora_gano_firma,forward_con_firma,otro,otro,sin_firma,unanime,0,4,"En consecuencia, entendió que “…la norma que establece el lí","Por lo expuesto, el Tribunal resuelve: I) Declarar procedent",Horacio Rosatti — Carlos Fernando Rosenkrantz — Juan Carlos Maqueda — Ricardo Lu
346_p432,346,mejora_gano_firma,forward_con_firma,otro,originaria,sin_firma,unanime,0,4,"En consecuencia, considera que la demandada pretende erigir ","Por ello, y de conformidad con lo dictaminado por la señora ",Horacio Rosatti — Carlos Fernando Rosenkrantz — Juan Carlos Maqueda — Ricardo Lu
346_p668,346,mejora_gano_firma,forward_con_firma,otro,otro,sin_firma,unanime,0,4,"de conformidad con los principios de orden público interno, ","Por lo expuesto, de conformidad en lo pertinente con lo dict",Horacio Rosatti — Carlos Fernando Rosenkrantz — Juan Carlos Maqueda — Ricardo Lu
346_p1015,346,mejora_gano_firma,forward_con_firma,otro,otro,sin_firma,segun_su_voto,0,4,"En consecuencia, la pretensión impositiva del Fisco local se","Por ello, y de conformidad con lo dictaminado por la señora ",Horacio Rosatti — Carlos Fernando Rosenkrantz (según su voto)— Juan Carlos Maque
346_p1089,346,mejora_gano_firma,forward_con_firma,otro,originaria,sin_firma,unanime,0,4,"En consecuencia, la sentencia que se dicte en este pleito no","Por ello, y habiendo dictaminado la señora Procuradora Gener",Horacio Rosatti — Carlos Fernando Rosenkrantz — Juan Carlos Maqueda — Ricardo Lu
346_p1117,346,mejora_gano_firma,forward_con_firma,otro,otro,sin_firma,unanime,0,3,"En consecuencia, en virtud de las sucesivas delegaciones rea","En consecuencia, las costas del proceso serán impuestas en e",Carlos Fernando Rosenkrantz — Juan Carlos Maqueda — Ricardo Luis Lorenzetti. Par
346_p1218,346,mejora_gano_firma,forward_con_firma,otro,otro,sin_firma,segun_su_voto,0,4,"En consecuencia, la alegada improcedencia de la acción por p","Por ello, y de conformidad con lo dictaminado por la señora ",Horacio Rosatti — Carlos Fernando Rosenkrantz (según su voto)— Juan Carlos Maque
346_p1471,346,mejora_gano_firma,forward_con_firma,otro,otro,sin_firma,segun_su_voto,0,3,"En consecuencia, declaró que le correspondía a la actora el ","Por todo lo expuesto, se declaran procedentes los recursos e",Horacio Rosatti — Carlos Fernando Rosenkrantz (según su voto)— Juan Carlos Maque
347_p128,347,mejora_gano_firma,forward_con_firma,otro,originaria,sin_firma,disidencia,0,4,de conformidad con lo informado a fs. 1760; ver también sent,"Por ello, se resuelve: I. Hacer lugar a la demanda seguida p",Horacio Rosatti — Carlos Fernando Rosenkrantz (en disidencia parcial)— Juan Carl
347_p178,347,mejora_gano_firma,forward_con_firma,otro,originaria,sin_firma,disidencia,0,4,"En consecuencia, en virtud de los fundamentos y las conclusi","Por ello, se resuelve: I. Hacer lugar a la demanda seguida p",Horacio Rosatti — Carlos Fernando Rosenkrantz (en disidencia parcial)— Juan Carl
347_p302,347,mejora_gano_firma,forward_con_firma,otro,otro,sin_firma,unanime,0,3,Por ello y a resultas del rechazo que se adopta también resp,"Por ello, de conformidad en lo pertinente con lo dictaminado",Horacio Rosatti — Carlos Fernando Rosenkrantz — Ricardo Luis Lorenzetti. Recurso
347_p321,347,mejora_gano_firma,forward_con_firma,otro,otro,sin_firma,unanime,0,5,"En consecuencia, pide que se declare la nulidad absoluta e i","Por ello, se resuelve rechazar in limine la demanda promovid",Horacio Rosatti — Carlos Fernando Rosenkrantz — Juan Carlos Maqueda — Ricardo Lu
347_p579,347,mejora_gano_firma,forward_con_firma,otro,hace_lugar,sin_firma,unanime,0,4,"en consecuencia, confirmar la desestimación del ajuste de la","Por ello, de conformidad con lo dictaminado por la señora Pr",Horacio Rosatti — Carlos Fernando Rosenkrantz — Juan Carlos Maqueda — Ricardo Lu
347_p673,347,mejora_gano_firma,forward_con_firma,otro,otro,sin_firma,unanime,0,3,"En consecuencia, más allá de la solución que en definitiva q","Por ello, se resuelve: 1) rechazar el recurso extraordinario",Horacio Rosatti — Carlos Fernando Rosenkrantz — Juan Carlos Maqueda. Recursos ex
347_p721,347,mejora_gano_firma,forward_con_firma,otro,hace_lugar,sin_firma,segun_su_voto,0,4,"Por ello, cabía concluir en que la parte actora había tenido","Por ello, se hace lugar a la queja, se declara procedente el",Horacio Rosatti — Carlos Fernando Rosenkrantz (según su voto)— Juan Carlos Maque
347_p802,347,mejora_gano_firma,forward_con_firma,otro,procedente,sin_firma,unanime,0,4,"en consecuencia, jueces últimos respecto de las vías de acce","Por ello, y de conformidad con las conclusiones de la señora",Horacio Rosatti — Carlos Fernando Rosenkrantz — Juan Carlos Maqueda — Ricardo Lu
347_p959,347,mejora_gano_firma,forward_con_firma,otro,otro,sin_firma,unanime,0,4,"En consecuencia, la alegada improcedencia formal de la acció","Por ello, y oída la señora Procuradora Fiscal, se decide: Ha",Horacio Rosatti — Carlos Fernando Rosenkrantz — Juan Carlos Maqueda — Ricardo Lu
347_p1230,347,mejora_gano_firma,forward_con_firma,otro,hace_lugar,sin_firma,disidencia,0,4,de conformidad con lo indicado por su médica tratante.,"Por ello, se hace lugar a la queja, se declara procedente el",Horacio Rosatti (en disidencia)— Carlos Fernando Rosenkrantz — Juan Carlos Maque
347_p1288,347,mejora_gano_firma,forward_con_firma,otro,hace_lugar,sin_firma,segun_su_voto,0,4,"En consecuencia, sostuvo que la derogación de las limitacion","Por ello, oída la señora Procuradora Fiscal, se hace lugar a",Horacio Rosatti — Carlos Fernando Rosenkrantz (según su voto)— Juan Carlos Maque
347_p1327,347,mejora_gano_firma,forward_con_firma,otro,confirma,sin_firma,segun_su_voto,0,4,"Por todo ello, corresponde incluir en el haber mensual con c","Por ello, de conformidad con lo dictaminado por la señora Pr",Horacio Rosatti — Carlos Fernando Rosenkrantz (según su voto)— Juan Carlos Maque
347_p1434,347,mejora_gano_firma,forward_con_firma,otro,otro,sin_firma,unanime,0,3,"Por ello, las competencias que se le asignen por ley, así co","Por ello, el Tribunal resuelve: declarar la invalidez consti",Horacio Rosatti — Juan Carlos Maqueda — Ricardo Luis Lorenzetti.
347_p1632,347,mejora_gano_firma,forward_con_firma,otro,hace_lugar,sin_firma,segun_su_voto,0,4,"En consecuencia, consideró que la actitud del fisco imposibi","Por ello, se hace lugar a la queja, se declara procedente el",Horacio Rosatti — Carlos Fernando Rosenkrantz (según su voto)— Juan Carlos Maque
347_p1807,347,mejora_gano_firma,forward_con_firma,otro,hace_lugar,sin_firma,segun_su_voto,0,4,de conformidad con lo normado en los arts. 78 y 84 del Códig,"Por ello, se hace lugar a la queja, se declara procedente el",Horacio Rosatti (según su voto)— Carlos Fernando Rosenkrantz — Juan Carlos Maque
